{
  "id": "physics-2-sources-of-magnetic-fields-0008",
  "subject": "physics-2",
  "lesson": "sources-of-magnetic-fields",
  "contentType": "question",
  "questionType": "multiple-choice",
  "question": "**Type:** direction-and-sign Which reasoning choice is most reliable when analyzing ferromagnetic paramagnetic and diamagnetic behavior in sources of magnetic fields?",
  "options": [
    {
      "id": "a",
      "text": "Declare a convention and keep it through every step"
    },
    {
      "id": "b",
      "text": "Make every answer positive"
    },
    {
      "id": "c",
      "text": "Reverse the convention after calculating"
    },
    {
      "id": "d",
      "text": "Use direction words without defining an axis"
    }
  ],
  "correctAnswer": "a",
  "explanation": "Declare a convention and keep it through every step because it connects the physical definition to evidence and preserves the stated assumptions. B assigns meaning without checking the model, C discards information needed for verification, and D replaces a physical test with an unsupported shortcut. The repository convention remains in force: signs and directions are defined before calculation.",
  "difficulty": "unknown",
  "tags": [
    "ferromagnetic",
    "paramagnetic",
    "diamagnetic",
    "behavior"
  ],
  "source": "Original local study collection",
  "originalFile": "data/source-provenance.json#source-65aa8b0c712fa5e7",
  "status": "approved",
  "reviewStatus": "audited",
  "humanVerificationRequired": false
}
