{
  "id": "biology-2-prokaryotes-bacteria-and-archaea-0001",
  "subject": "biology-2",
  "lesson": "prokaryotes-bacteria-and-archaea",
  "contentType": "question",
  "questionType": "multiple-choice",
  "question": "A student Gram stains two bacterial species and views them under a microscope. Species X holds the purple crystal violet stain, while species Y appears pink after the decolorizing step. Which structural feature of the **cell wall** best explains the two results?",
  "options": [
    {
      "id": "a",
      "text": "Species X has a thick **peptidoglycan** layer that traps the crystal violet, while species Y has a thin layer behind an outer membrane."
    },
    {
      "id": "b",
      "text": "Species Y has the thicker peptidoglycan layer, and species X lacks a cell wall altogether."
    },
    {
      "id": "c",
      "text": "Species X makes a capsule that permanently binds the purple dye to the outside of the cell."
    },
    {
      "id": "d",
      "text": "Species Y carries more ribosomes, which soak up the dye and hold it in the cytoplasm."
    }
  ],
  "correctAnswer": "a",
  "explanation": "Gram positive cells keep the crystal violet because their thick peptidoglycan retains the dye through decolorization, while Gram negative cells lose it and pick up the pink counterstain. B reverses the two wall architectures. C ignores the role of peptidoglycan, and D mistakes ribosomes, which have nothing to do with the stain, for the dye trap.",
  "difficulty": "unknown",
  "tags": [
    "gram",
    "staining",
    "cell",
    "wall",
    "structure"
  ],
  "source": "Original local study collection",
  "originalFile": "data/source-provenance.json#source-8607f12dba8274af",
  "status": "approved",
  "reviewStatus": "audited",
  "humanVerificationRequired": false
}
