{
  "id": "physics-1-kinematics-in-two-dimensions-0009",
  "subject": "physics-1",
  "lesson": "kinematics-in-two-dimensions",
  "contentType": "question",
  "questionType": "multiple-choice",
  "question": "**Type:** graph-interpretation Which reasoning choice is most reliable when analyzing vector addition and subtraction in kinematics in two dimensions?",
  "options": [
    {
      "id": "a",
      "text": "Treat every slope as a speed"
    },
    {
      "id": "b",
      "text": "Read the axis units before assigning meaning to slope or area"
    },
    {
      "id": "c",
      "text": "Treat every area as an energy"
    },
    {
      "id": "d",
      "text": "Ignore the intercept as decorative"
    }
  ],
  "correctAnswer": "b",
  "explanation": "Read the axis units before assigning meaning to slope or area because it connects the physical definition to evidence and preserves the stated assumptions. A assigns meaning without checking the model, C discards information needed for verification, and D replaces a physical test with an unsupported shortcut. The repository convention remains in force: signs and directions are defined before calculation.",
  "difficulty": "unknown",
  "tags": [
    "vector",
    "addition",
    "subtraction"
  ],
  "source": "Original local study collection",
  "originalFile": "data/source-provenance.json#source-b94dd401760db2f8",
  "status": "approved",
  "reviewStatus": "audited",
  "humanVerificationRequired": false
}
