{
  "id": "physics-1-thermodynamics-i-laws-and-processes-0004",
  "subject": "physics-1",
  "lesson": "thermodynamics-i-laws-and-processes",
  "contentType": "question",
  "questionType": "multiple-choice",
  "question": "**Type:** calculation For work as area on a pv diagram, use $W = P Delta V$ in a isobaric process model. The first quantity is 345.00 Pa and the second is 0.040 m^3. What is the work by gas?",
  "options": [
    {
      "id": "a",
      "text": "$13.80\\ \\text{J}$"
    },
    {
      "id": "b",
      "text": "$6.90\\ \\text{J}$"
    },
    {
      "id": "c",
      "text": "$27.60\\ \\text{J}$"
    },
    {
      "id": "d",
      "text": "$13.84\\ \\text{J}$"
    }
  ],
  "correctAnswer": "a",
  "explanation": "Using $W = P Delta V$ gives 345.00 Pa times 0.040 m^3 = $13.80\\ \\text{J}$. The option at half the result drops a factor, the option at twice the result duplicates a factor, and the remaining distractor combines the inputs with the wrong operation. Units reduce to J, so the value and dimension agree.",
  "difficulty": "unknown",
  "tags": [
    "work",
    "as",
    "area",
    "on",
    "pv",
    "diagram"
  ],
  "source": "Original local study collection",
  "originalFile": "data/source-provenance.json#source-07b8e02453e44d2c",
  "status": "approved",
  "reviewStatus": "audited",
  "humanVerificationRequired": false
}
