{
  "id": "biology-1-meiosis-and-sexual-reproduction-0007",
  "subject": "biology-1",
  "lesson": "meiosis-and-sexual-reproduction",
  "contentType": "question",
  "questionType": "multiple-choice",
  "question": "**Spermatogenesis** and **oogenesis** are the processes of gamete formation in animals. Which statement correctly describes how they differ?",
  "options": [
    {
      "id": "a",
      "text": "Spermatogenesis yields one large functional gamete and three polar bodies, while oogenesis yields four equal-sized sperm."
    },
    {
      "id": "b",
      "text": "Oogenesis begins at puberty, while spermatogenesis begins before birth."
    },
    {
      "id": "c",
      "text": "Oogenesis produces one large ovum that keeps most of the cytoplasm, while spermatogenesis produces four small, equal-sized sperm."
    },
    {
      "id": "d",
      "text": "Both processes produce four functional gametes from every primary sex cell."
    }
  ],
  "correctAnswer": "c",
  "explanation": "In oogenesis the cytoplasm is distributed unevenly so one ovum receives nearly all of it and the polar bodies receive very little, which supplies the future embryo with stored materials. In spermatogenesis meiosis produces four small motile gametes of roughly equal size, all of them functional. A swaps the two descriptions, B reverses when each process starts, and D ignores the polar bodies that limit oogenesis to one functional gamete per primary oocyte.",
  "difficulty": "unknown",
  "tags": [
    "spermatogenesis",
    "versus",
    "oogenesis"
  ],
  "source": "Original local study collection",
  "originalFile": "data/source-provenance.json#source-f0c6247e5915595a",
  "status": "approved",
  "reviewStatus": "audited",
  "humanVerificationRequired": false
}
