{
  "id": "physics-2-wave-optics-0003",
  "subject": "physics-2",
  "lesson": "wave-optics",
  "contentType": "question",
  "questionType": "multiple-choice",
  "question": "**Type:** calculation For young double slit geometry and fringe spacing, use $Delta r = m lambda$ in a interference path difference model. The first quantity is 3.15 dimensionless and the second is 0.50 m. What is the path difference?",
  "options": [
    {
      "id": "a",
      "text": "$0.79\\ \\text{m}$"
    },
    {
      "id": "b",
      "text": "$3.15\\ \\text{m}$"
    },
    {
      "id": "c",
      "text": "$1.97\\ \\text{m}$"
    },
    {
      "id": "d",
      "text": "$1.58\\ \\text{m}$"
    }
  ],
  "correctAnswer": "d",
  "explanation": "Using $Delta r = m lambda$ gives 3.15 dimensionless times 0.50 m = $1.58\\ \\text{m}$. The option at half the result drops a factor, the option at twice the result duplicates a factor, and the remaining distractor combines the inputs with the wrong operation. Units reduce to m, so the value and dimension agree.",
  "difficulty": "unknown",
  "tags": [
    "young",
    "double",
    "slit",
    "geometry",
    "fringe",
    "spacing"
  ],
  "source": "Original local study collection",
  "originalFile": "data/source-provenance.json#source-0ce9c49c8559f911",
  "status": "approved",
  "reviewStatus": "audited",
  "humanVerificationRequired": false
}
