{
  "id": "physics-2-sources-of-magnetic-fields-0009",
  "subject": "physics-2",
  "lesson": "sources-of-magnetic-fields",
  "contentType": "question",
  "questionType": "multiple-choice",
  "question": "**Type:** concept Which reasoning choice is most reliable when analyzing magnetic domains and hysteresis qualitatively in sources of magnetic fields?",
  "options": [
    {
      "id": "a",
      "text": "Use a symbol without defining it"
    },
    {
      "id": "b",
      "text": "Connect the definition model and measurable evidence"
    },
    {
      "id": "c",
      "text": "Choose an equation by visual familiarity"
    },
    {
      "id": "d",
      "text": "Accept any dimensionally consistent expression"
    }
  ],
  "correctAnswer": "b",
  "explanation": "Connect the definition model and measurable evidence because it connects the physical definition to evidence and preserves the stated assumptions. A assigns meaning without checking the model, C discards information needed for verification, and D replaces a physical test with an unsupported shortcut. The repository convention remains in force: signs and directions are defined before calculation.",
  "difficulty": "unknown",
  "tags": [
    "magnetic",
    "domains",
    "hysteresis",
    "qualitatively"
  ],
  "source": "Original local study collection",
  "originalFile": "data/source-provenance.json#source-65aa8b0c712fa5e7",
  "status": "approved",
  "reviewStatus": "audited",
  "humanVerificationRequired": false
}
