{
  "id": "physics-1-units-measurement-and-dimensional-analysis-0006",
  "subject": "physics-1",
  "lesson": "units-measurement-and-dimensional-analysis",
  "contentType": "question",
  "questionType": "multiple-choice",
  "question": "**Type:** calculation For dimensional analysis for equation checking, use $L = L_0 C$ in a conversion factor model. The first quantity is 3.38 km and the second is 1000.00 m/km. What is the converted length?",
  "options": [
    {
      "id": "a",
      "text": "$1687.50\\ \\text{m}$"
    },
    {
      "id": "b",
      "text": "$6750.00\\ \\text{m}$"
    },
    {
      "id": "c",
      "text": "$3375.00\\ \\text{m}$"
    },
    {
      "id": "d",
      "text": "$4375.00\\ \\text{m}$"
    }
  ],
  "correctAnswer": "c",
  "explanation": "Using $L = L_0 C$ gives 3.38 km times 1000.00 m/km = $3375.00\\ \\text{m}$. The option at half the result drops a factor, the option at twice the result duplicates a factor, and the remaining distractor combines the inputs with the wrong operation. Units reduce to m, so the value and dimension agree.",
  "difficulty": "unknown",
  "tags": [
    "dimensional",
    "analysis",
    "equation",
    "checking"
  ],
  "source": "Original local study collection",
  "originalFile": "data/source-provenance.json#source-b3622b49e58e0cb8",
  "status": "approved",
  "reviewStatus": "audited",
  "humanVerificationRequired": false
}
