{
  "id": "physics-1-oscillations-and-simple-harmonic-motion-0010",
  "subject": "physics-1",
  "lesson": "oscillations-and-simple-harmonic-motion",
  "contentType": "question",
  "questionType": "multiple-choice",
  "question": "**Type:** limiting-case Which reasoning choice is most reliable when analyzing conditions for simple harmonic motion in oscillations and simple harmonic motion?",
  "options": [
    {
      "id": "a",
      "text": "Round every input to zero"
    },
    {
      "id": "b",
      "text": "Replace the model with a memorized example"
    },
    {
      "id": "c",
      "text": "Let one input approach an extreme and test the predicted trend"
    },
    {
      "id": "d",
      "text": "Assume all dependencies are linear"
    }
  ],
  "correctAnswer": "c",
  "explanation": "Let one input approach an extreme and test the predicted trend because it connects the physical definition to evidence and preserves the stated assumptions. A assigns meaning without checking the model, B discards information needed for verification, and D replaces a physical test with an unsupported shortcut. The repository convention remains in force: signs and directions are defined before calculation.",
  "difficulty": "unknown",
  "tags": [
    "conditions",
    "simple",
    "harmonic",
    "motion"
  ],
  "source": "Original local study collection",
  "originalFile": "data/source-provenance.json#source-11fa68e46a87e419",
  "status": "approved",
  "reviewStatus": "audited",
  "humanVerificationRequired": false
}
