{
  "id": "genetics-population-genetics-and-evolution-0004",
  "subject": "genetics",
  "lesson": "population-genetics-and-evolution",
  "contentType": "question",
  "questionType": "multiple-choice",
  "question": "**Type:** concept Which condition is required for a population to remain in Hardy Weinberg equilibrium at a locus?",
  "options": [
    {
      "id": "a",
      "text": "Individuals mate preferentially with genetically similar partners"
    },
    {
      "id": "b",
      "text": "The population is subdivided into many small isolated groups"
    },
    {
      "id": "c",
      "text": "Heterozygotes have higher fitness than either homozygote"
    },
    {
      "id": "d",
      "text": "Mating is random with respect to the locus, and selection, mutation, migration, and drift are absent"
    }
  ],
  "correctAnswer": "d",
  "explanation": "Hardy Weinberg equilibrium requires random mating plus the absence of the evolutionary forces: no selection, no mutation, no migration, and a large population size that avoids drift. Option A describes nonrandom mating and B describes subdivision, both of which push genotype frequencies away from equilibrium. C, heterozygote advantage, is a form of selection that can maintain both alleles, but it violates the equilibrium assumptions.",
  "difficulty": "unknown",
  "tags": [
    "conditions",
    "hardy",
    "weinberg",
    "equilibrium"
  ],
  "source": "Original local study collection",
  "originalFile": "data/source-provenance.json#source-c8080c5df327048e",
  "status": "approved",
  "reviewStatus": "audited",
  "humanVerificationRequired": false
}
