{
  "id": "biology-2-origin-and-history-of-life-0005",
  "subject": "biology-2",
  "lesson": "origin-and-history-of-life",
  "contentType": "question",
  "questionType": "multiple-choice",
  "question": "In the laboratory, molecules can assemble into **protobionts**, droplet-like structures with a membrane. Why do scientists consider protobionts important for understanding the origin of cells?",
  "options": [
    {
      "id": "a",
      "text": "They show how a boundary membrane and internal chemistry could form before true cells existed."
    },
    {
      "id": "b",
      "text": "They prove that living cells can be created from scratch in a laboratory."
    },
    {
      "id": "c",
      "text": "They are the direct ancestors of modern bacteria and contain DNA and ribosomes."
    },
    {
      "id": "d",
      "text": "They demonstrate that RNA was always present inside the first membranes."
    }
  ],
  "correctAnswer": "a",
  "explanation": "Protobionts are membrane-bound droplets that grow, split, and hold an internal chemistry, so they demonstrate that the step before a true cell is chemically possible. B overstates the finding, because protobionts are not alive and lack the genetic machinery of cells. C overstates their relation to bacteria, and D is not demonstrated, since protobionts can form without RNA.",
  "difficulty": "unknown",
  "tags": [
    "protobionts",
    "as",
    "first",
    "step"
  ],
  "source": "Original local study collection",
  "originalFile": "data/source-provenance.json#source-e44bf19886952277",
  "status": "approved",
  "reviewStatus": "audited",
  "humanVerificationRequired": false
}
