{
  "id": "physics-1-oscillations-and-simple-harmonic-motion-0008",
  "subject": "physics-1",
  "lesson": "oscillations-and-simple-harmonic-motion",
  "contentType": "question",
  "questionType": "multiple-choice",
  "question": "**Type:** direction-and-sign Which reasoning choice is most reliable when analyzing damped oscillation regimes in oscillations and simple harmonic motion?",
  "options": [
    {
      "id": "a",
      "text": "Declare a convention and keep it through every step"
    },
    {
      "id": "b",
      "text": "Make every answer positive"
    },
    {
      "id": "c",
      "text": "Reverse the convention after calculating"
    },
    {
      "id": "d",
      "text": "Use direction words without defining an axis"
    }
  ],
  "correctAnswer": "a",
  "explanation": "Declare a convention and keep it through every step because it connects the physical definition to evidence and preserves the stated assumptions. B assigns meaning without checking the model, C discards information needed for verification, and D replaces a physical test with an unsupported shortcut. The repository convention remains in force: signs and directions are defined before calculation.",
  "difficulty": "unknown",
  "tags": [
    "damped",
    "oscillation",
    "regimes"
  ],
  "source": "Original local study collection",
  "originalFile": "data/source-provenance.json#source-11fa68e46a87e419",
  "status": "approved",
  "reviewStatus": "audited",
  "humanVerificationRequired": false
}
