{
  "id": "physics-2-electromagnetic-induction-0008",
  "subject": "physics-2",
  "lesson": "electromagnetic-induction",
  "contentType": "question",
  "questionType": "multiple-choice",
  "question": "**Type:** direction-and-sign Which reasoning choice is most reliable when analyzing transformer turns ratio and power conservation in electromagnetic induction?",
  "options": [
    {
      "id": "a",
      "text": "Declare a convention and keep it through every step"
    },
    {
      "id": "b",
      "text": "Make every answer positive"
    },
    {
      "id": "c",
      "text": "Reverse the convention after calculating"
    },
    {
      "id": "d",
      "text": "Use direction words without defining an axis"
    }
  ],
  "correctAnswer": "a",
  "explanation": "Declare a convention and keep it through every step because it connects the physical definition to evidence and preserves the stated assumptions. B assigns meaning without checking the model, C discards information needed for verification, and D replaces a physical test with an unsupported shortcut. The repository convention remains in force: signs and directions are defined before calculation.",
  "difficulty": "unknown",
  "tags": [
    "transformer",
    "turns",
    "ratio",
    "power",
    "conservation"
  ],
  "source": "Original local study collection",
  "originalFile": "data/source-provenance.json#source-ebd801aa686adb92",
  "status": "approved",
  "reviewStatus": "audited",
  "humanVerificationRequired": false
}
