{
  "id": "biology-1-energy-and-metabolism-basics-0004",
  "subject": "biology-1",
  "lesson": "energy-and-metabolism-basics",
  "contentType": "question",
  "questionType": "multiple-choice",
  "question": "In aerobic respiration, pyruvate from glycolysis enters the mitochondria, where each **pyruvate** is converted to **acetyl CoA**. Where does this conversion, called pyruvate oxidation, occur, and what are its products?",
  "options": [
    {
      "id": "a",
      "text": "In the cytosol, producing NADH and FADH2."
    },
    {
      "id": "b",
      "text": "On the outer mitochondrial membrane, producing glucose."
    },
    {
      "id": "c",
      "text": "In the intermembrane space, producing lactate."
    },
    {
      "id": "d",
      "text": "In the mitochondrial matrix, producing acetyl CoA, CO2, and NADH."
    }
  ],
  "correctAnswer": "d",
  "explanation": "Pyruvate oxidation occurs in the mitochondrial matrix, where each pyruvate loses one carbon as CO2 and gains coenzyme A, generating NADH. A and C name the wrong compartments. B invents glucose production on the wrong membrane.",
  "difficulty": "unknown",
  "tags": [
    "pyruvate",
    "oxidation",
    "location",
    "products"
  ],
  "source": "Original local study collection",
  "originalFile": "data/source-provenance.json#source-fa041cb89290bc9b",
  "status": "approved",
  "reviewStatus": "audited",
  "humanVerificationRequired": false
}
