{
  "id": "biology-2-ecosystem-and-conservation-ecology-0006",
  "subject": "biology-2",
  "lesson": "ecosystem-and-conservation-ecology",
  "contentType": "question",
  "questionType": "multiple-choice",
  "question": "Unlike the carbon cycle and the nitrogen cycle, the **phosphorus cycle** has no significant gaseous phase. Which consequence follows from this difference?",
  "options": [
    {
      "id": "a",
      "text": "Phosphorus moves freely through the atmosphere, so it never limits plant growth."
    },
    {
      "id": "b",
      "text": "Phosphorus moves mainly through rock, soil, water, and organisms, so its supply is slow and local."
    },
    {
      "id": "c",
      "text": "Phosphorus is a rare element that plays no role in living cells."
    },
    {
      "id": "d",
      "text": "Plants obtain phosphorus directly from the air like carbon dioxide."
    }
  ],
  "correctAnswer": "b",
  "explanation": "The phosphorus cycle moves through weathering rock, soil, water, and organisms with no atmospheric step, so fresh phosphorus arrives slowly and often limits productivity. A and D describe an atmospheric phase that does not exist. C is false because phosphorus forms part of ATP, nucleic acids, and cell membranes.",
  "difficulty": "unknown",
  "tags": [
    "phosphorus",
    "cycle",
    "without",
    "gaseous",
    "phase"
  ],
  "source": "Original local study collection",
  "originalFile": "data/source-provenance.json#source-88a3f43382189835",
  "status": "approved",
  "reviewStatus": "audited",
  "humanVerificationRequired": false
}
