{
  "id": "biology-2-reproduction-and-development-0001",
  "subject": "biology-2",
  "lesson": "reproduction-and-development",
  "contentType": "question",
  "questionType": "multiple-choice",
  "question": "A population of aphids reproduces entirely by **asexual reproduction** for many generations. Which of the following is the most serious long-term disadvantage of this strategy?",
  "options": [
    {
      "id": "a",
      "text": "The population will produce little or no genetic variation, leaving it vulnerable if the environment changes."
    },
    {
      "id": "b",
      "text": "Each offspring will have a new combination of genes from two parents, which slows reproduction."
    },
    {
      "id": "c",
      "text": "The population will grow so slowly that it cannot replace individuals that die."
    },
    {
      "id": "d",
      "text": "Offspring will be genetically identical to both parents at once, which doubles the mutation load."
    }
  ],
  "correctAnswer": "a",
  "explanation": "Asexual reproduction produces genetically identical offspring with no recombination, so no new gene combinations arise to respond to a changing environment. B describes sexual reproduction, whose genetic novelty is exactly what asexual populations lack. C is false because asexual reproduction is usually fast and produces many offspring. D is wrong because asexual offspring are copies of a single parent, not a fusion of two.",
  "difficulty": "unknown",
  "tags": [
    "what",
    "asexual",
    "reproduction",
    "loses"
  ],
  "source": "Original local study collection",
  "originalFile": "data/source-provenance.json#source-a6d08fc2324dcc34",
  "status": "approved",
  "reviewStatus": "audited",
  "humanVerificationRequired": false
}
